{
  "artifact": "quantum_problem",
  "artifact_schema_version": "1.0",
  "assignment_qubits": 1,
  "bit_order": "Qiskit little-endian: qubit i is character [-1 - i] of a counts key",
  "eliminated_variables": [
    {
      "node": "worker-01",
      "pod": "analytics/batch-worker-8c9d0e-aaaaa",
      "reason": "INDIVIDUALLY_INFEASIBLE:cpu,memory"
    },
    {
      "node": "worker-01",
      "pod": "analytics/reporter-9e8d7c-aaaaa",
      "reason": "INDIVIDUALLY_INFEASIBLE:cpu"
    }
  ],
  "fixture": "fixture_b_insufficient",
  "generator": {
    "milestone": "M3",
    "name": "qplace",
    "version": "0.1.0"
  },
  "m2_assessment": "REVIEW_REQUIRED",
  "m2_conditions": [
    "CANDIDATE_REQUEST_REVIEW_REQUIRED:analytics/reporter-9e8d7c-aaaaa"
  ],
  "m2_variables": [
    {
      "node": "worker-01",
      "pod": "analytics/batch-worker-8c9d0e-aaaaa"
    },
    {
      "node": "worker-01",
      "pod": "analytics/ingest-1a2b3c-aaaaa"
    },
    {
      "node": "worker-01",
      "pod": "analytics/reporter-9e8d7c-aaaaa"
    }
  ],
  "qubit_budget": 12,
  "qubits": [
    {
      "kind": "assignment",
      "node": "worker-01",
      "pod": "analytics/ingest-1a2b3c-aaaaa",
      "qubit": 0
    }
  ],
  "required_qubits": 1,
  "slack_qubits": 0,
  "source": {
    "snapshot_id": "fixture-b-insufficient",
    "source_sha256": "6959fbc701e487288f5caeab3e42963506b4c1b773811f3d371a0316846ea04a"
  },
  "status": "SUPPORTED",
  "target_node": "worker-02"
}
