{
  "artifact": "quantum_problem",
  "artifact_schema_version": "1.0",
  "assignment_qubits": 6,
  "bit_order": "Qiskit little-endian: qubit i is character [-1 - i] of a counts key",
  "eliminated_variables": [],
  "fixture": "scenario_a_feasible",
  "generator": {
    "milestone": "M3",
    "name": "qplace",
    "version": "0.1.0"
  },
  "m2_assessment": "MODELED_FEASIBLE",
  "m2_conditions": [],
  "m2_variables": [
    {
      "node": "worker-01",
      "pod": "shop/api-6e5d4c-aaaaa"
    },
    {
      "node": "worker-02",
      "pod": "shop/api-6e5d4c-aaaaa"
    },
    {
      "node": "worker-01",
      "pod": "shop/cache-0"
    },
    {
      "node": "worker-02",
      "pod": "shop/cache-0"
    },
    {
      "node": "worker-01",
      "pod": "shop/web-5d4c3b-bbbbb"
    },
    {
      "node": "worker-02",
      "pod": "shop/web-5d4c3b-bbbbb"
    }
  ],
  "qubit_budget": 12,
  "qubits": [
    {
      "kind": "assignment",
      "node": "worker-01",
      "pod": "shop/api-6e5d4c-aaaaa",
      "qubit": 0
    },
    {
      "kind": "assignment",
      "node": "worker-02",
      "pod": "shop/api-6e5d4c-aaaaa",
      "qubit": 1
    },
    {
      "kind": "assignment",
      "node": "worker-01",
      "pod": "shop/cache-0",
      "qubit": 2
    },
    {
      "kind": "assignment",
      "node": "worker-02",
      "pod": "shop/cache-0",
      "qubit": 3
    },
    {
      "kind": "assignment",
      "node": "worker-01",
      "pod": "shop/web-5d4c3b-bbbbb",
      "qubit": 4
    },
    {
      "kind": "assignment",
      "node": "worker-02",
      "pod": "shop/web-5d4c3b-bbbbb",
      "qubit": 5
    }
  ],
  "required_qubits": 6,
  "slack_qubits": 0,
  "source": {
    "snapshot_id": "m2-scenario-a-feasible",
    "source_sha256": "c63654c225a1f1ae508046a1f8cde3275e886e82ccc9ba1eafeb51c2a657db47"
  },
  "status": "SUPPORTED",
  "target_node": "worker-03"
}
